title,author,tags,link,source
Automatically Find and Log Bugs in Your Node.js App with Raygun,Ado Kukic,node.js,https://scotch.io/tutorials/automatically-find-and-log-bugs-in-your-node-js-app-with-raygun,Scotch
How to Build a WordPress Plugin (part 2),Guillaume Kanoufi,"php,plugin,wordpress",https://scotch.io/tutorials/how-to-build-a-wordpress-plugin-part-2,Scotch
Build an Etsy Clone with Angular and Stamplay (Part 1),Chris Sevilleja,"angularJS,stamplay",https://scotch.io/tutorials/build-an-etsy-clone-with-angular-and-stamplay-part-1,Scotch
Build an App with Vue.js: A Lightweight Alternative to AngularJS,Ryan Chenkie,"javascript,vue.js",https://scotch.io/tutorials/build-an-app-with-vue-js-a-lightweight-alternative-to-angularjs,Scotch
Understanding Laravel Environment Variables,Matthew Lenhard,laravel,https://scotch.io/tutorials/understanding-laravel-environment-variables,Scotch
Build A Web Application with Backbone by Listening for Events,Igor Ribeiro Lima,Backbone,https://scotch.io/tutorials/build-a-web-application-with-backbone-by-listening-for-events,Scotch
Build a Real-Time Polymer To-Do App,Kevin Gleason,polymer,https://scotch.io/tutorials/build-a-real-time-polymer-to-do-app,Scotch
How to Build a WordPress Plugin (part 1),Guillaume Kanoufi,"php,plugin,wordpress",https://scotch.io/tutorials/how-to-build-a-wordpress-plugin-part-1,Scotch
Deploying a MEAN App to Amazon EC2 (Part 2),Ahmed Haque,"deployment,ec2,MEAN",https://scotch.io/tutorials/deploying-a-mean-app-to-amazon-ec2-part-2,Scotch
Deploying a MEAN App to Amazon EC2 (Part 1),Ahmed Haque,"deployment,ec2,MEAN",https://scotch.io/tutorials/deploying-a-mean-app-to-amazon-ec2-part-1,Scotch
Use MongoDB with a Node.js Application on Heroku,Igor Ribeiro Lima,"expressJS,heroku,javascript,mongoDB,node.js",https://scotch.io/tutorials/use-mongodb-with-a-node-application-on-heroku,Scotch
Getting Started with Vim: An Interactive Guide,Nicholas Cerminara,"editors,vim",https://scotch.io/tutorials/getting-started-with-vim-an-interactive-guide,Scotch
Build a Real-Time Markdown Editor with Node.js,Asif Ahmed,"node.js,real time",https://scotch.io/tutorials/building-a-real-time-markdown-viewer,Scotch
Token-Based Authentication for AngularJS and Laravel Apps,Ryan Chenkie,"angularJS,laravel,php",https://scotch.io/tutorials/token-based-authentication-for-angularjs-and-laravel-apps,Scotch
Handling File Uploads Painlessly with Filepicker,Nicholas Cerminara,"filepicker,javascript,jquery",https://scotch.io/tutorials/handling-file-uploads-painlessly-with-filepicker,Scotch
Use Gulp to Start a Laravel PHP Server,Chris Sevilleja,"gulp,php",https://scotch.io/tutorials/use-gulp-to-start-a-laravel-php-server,Scotch
AngularJS Form Validation with ngMessages,Chris Sevilleja,"angularJS,forms,validation",https://scotch.io/tutorials/angularjs-form-validation-with-ngmessages,Scotch
Deploy PHP Apps Easily with Laravel Forge,Chris Sevilleja,laravel,https://scotch.io/tutorials/deploy-php-apps-easily-with-laravel-forge,Scotch
Build an AngularJS App with Stamplay: The IFTTT for Developers,Chris Sevilleja,"javascript,stamplay",https://scotch.io/tutorials/build-an-angularjs-app-with-stamplay-the-ifttt-for-developers,Scotch
Building a Slack Clone in Meteor.js (Part 5): Meteor Deployment,Daniel Li,"javascript,meteor,node.js",https://scotch.io/tutorials/building-a-slack-clone-in-meteor-js-part-5-deployment,Scotch
Easy AngularJS Forms with angular-formly,Ryan Chenkie,"angularJS,javascript",https://scotch.io/tutorials/easy-angularjs-forms-with-angular-formly,Scotch
Building a Slack Clone in Meteor.js (Part 4): Channels and Chat Rooms,Daniel Li,"meteor,node.js",https://scotch.io/tutorials/building-a-slack-clone-in-meteor-js-part-4-channels-and-chat-rooms,Scotch
How to Speed Up Meteor Development with Scaffolding And Automatic Form Generation,Sebastian,"iron-meteor,javascript,meteor,node.js",https://scotch.io/tutorials/how-to-speed-up-meteor-development-with-scaffolding-and-automatic-form-generation,Scotch
Building a Slack Clone in Meteor.js (Part 3): Authentication and Security,Daniel Li,"meteor,node.js",https://scotch.io/tutorials/building-a-slack-clone-in-meteor-js-part-3-authentication-and-security,Scotch
Real-Time Graph Database as a Service with Appbase,Igor Ribeiro Lima,"appbase,real time",https://scotch.io/tutorials/real-time-graph-database-as-a-service-with-appbase,Scotch
Building a Slack Clone in Meteor.js: Real-Time Data,Daniel Li,"meteor,node.js",https://scotch.io/tutorials/building-a-slack-clone-in-meteor-js-real-time-data,Scotch
Debugging Queries in Laravel,Eric Barnes,"laravel,php",https://scotch.io/tutorials/debugging-queries-in-laravel,Scotch
Building a Slack Clone in Meteor.js: Getting Started,Daniel Li,"javascript,meteor,node.js",https://scotch.io/tutorials/building-a-slack-clone-in-meteor-js-getting-started,Scotch
Deploying a LAMP stack on AWS (part 3): Deploy Infrastructure and Applications with Terraform,Kevin Fishner,"atlas,deployment,terraform,vagrant",https://scotch.io/tutorials/deploying-a-lamp-stack-on-aws-part-3-deploy-infrastructure-and-applications-with-terraform,Scotch
Building Responsive Email Templates with Ink,Nicholas Cerminara,"css,email,foundation,ink",https://scotch.io/tutorials/building-responsive-email-templates-with-ink,Scotch
Learn Meteor.js From Scratch: Build a Polling App,Chris Sevilleja,"javascript,meteor,node.js",https://scotch.io/tutorials/learn-meteor-js-from-scratch-build-a-polling-app,Scotch
Authenticate a Node.js API with JSON Web Tokens,Chris Sevilleja,"authentication,MEAN,node.js,tokens",https://scotch.io/tutorials/authenticate-a-node-js-api-with-json-web-tokens,Scotch
How to Catch Your Errors in Sublime Text 3,Chris Sevilleja,sublime text,https://scotch.io/tutorials/how-to-catch-your-errors-in-sublime-text-3,Scotch
Build a Time Tracker with Laravel 5 and AngularJS – Part 2,Ryan Chenkie,"angularJS,laravel,php",https://scotch.io/tutorials/build-a-time-tracker-with-laravel-5-and-angularjs-part-2,Scotch
Sublime Text and Emmet – Speed up HTML Development,Chris Sevilleja,sublime text,https://scotch.io/tutorials/sublime-text-and-emmet-speed-up-html-development,Scotch
A Visual Guide to CSS3 Flexbox Properties,Dimitar Stojanov,"css,flexbox",https://scotch.io/tutorials/a-visual-guide-to-css3-flexbox-properties,Scotch
Run Gulp Tasks in Laravel Easily with Elixir,Samuel Oloruntoba,"elixir,gulp,laravel",https://scotch.io/tutorials/run-gulp-tasks-in-laravel-easily-with-elixir,Scotch
Aesthetic Sass 2: Colors and Palettes,David Khourshid,"css,sass",https://scotch.io/tutorials/aesthetic-sass-2-colors,Scotch
Deploying a LAMP stack on AWS (part 2): Build Deployable Artifacts with Packer,Kevin Fishner,"atlas,deployment,packer,vagrant",https://scotch.io/tutorials/build-deployable-artifacts-with-packer,Scotch
Deploying a LAMP stack on AWS (part 1): Overview of the Atlas Workflow and Mindset,Kevin Fishner,"atlas,deployment,vagrant",https://scotch.io/tutorials/overview-of-the-atlas-workflow-and-mindset,Scotch
A Beginner’s Guide To Composer,Daniel Pataki,"composer,php",https://scotch.io/tutorials/a-beginners-guide-to-composer,Scotch
Build a Time Tracker with Laravel 5 and AngularJS – Part 1,Ryan Chenkie,"angularJS,laravel,php",https://scotch.io/tutorials/build-a-time-tracker-with-laravel-5-and-angularjs-part-1,Scotch
Build Chrome-like Tabs with Bootstrap and AngularJS,Dimitar Stojanov,"angularJS,bootstrap,chrome,sass",https://scotch.io/tutorials/build-chrome-like-tabs-with-bootstrap-and-angularjs,Scotch
Login with the Built-In Laravel 5 Scaffolding,Chris Sevilleja,"authentication,laravel",https://scotch.io/tutorials/login-with-the-built-in-laravel-5-scaffolding,Scotch
Aesthetic Sass 1: Architecture and Style Organization,David Khourshid,"css,sass",https://scotch.io/tutorials/aesthetic-sass-1-architecture-and-style-organization,Scotch
Only Grab the Files You Need While Using Bower,Chris Sevilleja,bower,https://scotch.io/tutorials/only-grab-the-files-you-need-while-using-bower,Scotch
"Jekyll, Github Pages, and Cloudflare for PageSpeed Win",James Steinbach,jekyll,https://scotch.io/tutorials/jekyll-github-pages-and-cloudflare-for-pagespeed-win,Scotch
Make a Mobile App with ReactJS in 30 Minutes,Nate Wienert,"javascript,react",https://scotch.io/tutorials/make-a-mobile-app-with-reactjs-in-30-minutes,Scotch
"Implement OAuth into your Express, Koa or Hapi applications using Grant",Simeon,"expressJS,hapi,koa,node.js,OAuth",https://scotch.io/tutorials/implement-oauth-into-your-express-koa-or-hapi-applications-using-grant,Scotch
Internationalization of AngularJS Applications,Serg,"angularJS,javascript",https://scotch.io/tutorials/internationalization-of-angularjs-applications,Scotch
A Quick Guide to Using LiveReload with Gulp,Kenny Song,"gulp,livereload",https://scotch.io/tutorials/a-quick-guide-to-using-livereload-with-gulp,Scotch
Sublime Text 3: Basic Packages,Chris Sevilleja,sublime text,https://scotch.io/tutorials/basic-packages,Scotch
Sublime Text 3: Manage Packages with Package Control,Chris Sevilleja,sublime text,https://scotch.io/tutorials/manage-packages-with-package-control,Scotch
Speed Up Your Deployment Workflow with Codeship and ParallelCI,Chris Sevilleja,deployment,https://scotch.io/tutorials/speed-up-your-deployment-workflow-with-codeship-and-parallelci,Scotch
Sublime Text 3: Multi-Selection Editing,Chris Sevilleja,sublime text,https://scotch.io/tutorials/multi-selection-editing,Scotch
Sublime Text 3: Built-In Features,Chris Sevilleja,sublime text,https://scotch.io/tutorials/sublime-text-built-in-features,Scotch
Getting Started with Vagrant Push,Nicholas Cerminara,vagrant,https://scotch.io/tutorials/getting-started-with-vagrant-push,Scotch
Sublime Text 3: Introduction,Chris Sevilleja,sublime text,https://scotch.io/tutorials/sublime-text-introduction,Scotch
Make Material Design Websites with the Materialize CSS Framework,Narayan Prusty,"css,material design",https://scotch.io/tutorials/make-material-design-websites-with-the-materialize-css-framework,Scotch
Getting Started with Less,Nicholas Cerminara,"css,gulp,LESS,node.js",https://scotch.io/tutorials/getting-started-with-less,Scotch
Display Time Relatively in Angular,Chris Sevilleja,angularJS,https://scotch.io/tutorials/display-time-relatively-in-angular,Scotch
Getting Started with Redis in PHP,Samuel Oloruntoba,"php,redis",https://scotch.io/tutorials/getting-started-with-redis-in-php,Scotch
Building Custom AngularJS Filters,Ado Kukic,"angularJS,javascript",https://scotch.io/tutorials/building-custom-angularjs-filters,Scotch
Getting Started with Foundation for Apps,Sara,"angularJS,foundation",https://scotch.io/tutorials/getting-started-with-foundation-for-apps,Scotch
Automate Your Tasks Easily with Gulp.js,Justin Rexroad,"gulp,javascript",https://scotch.io/tutorials/automate-your-tasks-easily-with-gulp-js,Scotch
Use ExpressJS to Get URL and POST Parameters,Chris Sevilleja,"expressJS,MEAN",https://scotch.io/tutorials/use-expressjs-to-get-url-and-post-parameters,Scotch
The Anatomy of a JSON Web Token,Chris Sevilleja,"authentication,tokens",https://scotch.io/tutorials/the-anatomy-of-a-json-web-token,Scotch
The Ins and Outs of Token Based Authentication,Chris Sevilleja,"authentication,tokens",https://scotch.io/tutorials/the-ins-and-outs-of-token-based-authentication,Scotch
Generate Fake Data for Your JavaScript Applications Using Faker,Chris Sevilleja,"javascript,node.js",https://scotch.io/tutorials/generate-fake-data-for-your-javascript-applications-using-faker,Scotch
Use ExpressJS to Deliver HTML Files,Chris Sevilleja,"expressJS,MEAN,node.js",https://scotch.io/tutorials/use-expressjs-to-deliver-html-files,Scotch
An Introduction to MongoDB,Chris Sevilleja,"MEAN,mongoDB",https://scotch.io/tutorials/an-introduction-to-mongodb,Scotch
Easily Develop Node.js and MongoDB Apps with Mongoose,Chris Sevilleja,"MEAN,mongoDB,node.js",https://scotch.io/tutorials/using-mongoosejs-in-node-js-and-mongodb-applications,Scotch
Making Skinny AngularJS Controllers,David Khourshid,angularJS,https://scotch.io/tutorials/making-skinny-angularjs-controllers,Scotch
Retrieving Comments With WP_Comment_Query In WordPress,Daniel Pataki,"php,wordpress",https://scotch.io/tutorials/retrieving-wp_comment_query-in-wordpress,Scotch
How to Correctly Use BootstrapJS and AngularJS Together,Chris Sevilleja,"angularJS,bootstrap",https://scotch.io/tutorials/how-to-correctly-use-bootstrapjs-and-angularjs-together,Scotch
Sort and Filter a Table Using Angular,Chris Sevilleja,angularJS,https://scotch.io/tutorials/sort-and-filter-a-table-using-angular,Scotch
Build a Real-Time Scheduling App using AngularJS and Firebase,Chris Sevilleja,"angularJS,firebase,real time",https://scotch.io/tutorials/build-a-real-time-scheduling-app-using-angularjs-and-firebase,Scotch
Building Interactive Scrolling Websites with ScrollMagic.js,Nicholas Cerminara,"css,javascript,jquery",https://scotch.io/tutorials/building-interactive-scrolling-websites-with-scrollmagic-js,Scotch
A Guide To Transients In WordPress,Daniel Pataki,"php,wordpress",https://scotch.io/tutorials/a-guide-to-transients-in-wordpress,Scotch
Text Backgrounds and Gradients with background-clip,Chris Sevilleja,css,https://scotch.io/tutorials/text-backgrounds-and-gradients-with-background-clip,Scotch
All About the Built-In AngularJS Filters,Ado Kukic,angularJS,https://scotch.io/tutorials/all-about-the-built-in-angularjs-filters,Scotch
Creating A Simple Shopping Cart with React.js and Flux,Ken Wheeler,"flux,react",https://scotch.io/tutorials/creating-a-simple-shopping-cart-with-react-js-and-flux,Scotch
Building Full Screen CSS3 Menus with Tons of Creative Demos,Nicholas Cerminara,css,https://scotch.io/tutorials/building-full-screen-css3-menus-with-tons-of-creative-demos,Scotch
Use the HTML5 File API to Work with Files Locally in the Browser,Spencer,,https://scotch.io/tutorials/use-the-html5-file-api-to-work-with-files-locally-in-the-browser,Scotch
"Getting To Know Flux, the React.js Architecture",Ken Wheeler,react,https://scotch.io/tutorials/getting-to-know-flux-the-react-js-architecture,Scotch
How to Deploy a Node.js App to Heroku,Chris Sevilleja,"deployment,heroku,node.js",https://scotch.io/tutorials/how-to-deploy-a-node-js-app-to-heroku,Scotch
How to Create a Vagrant Base Box from an Existing One,Nicholas Cerminara,vagrant,https://scotch.io/tutorials/how-to-create-a-vagrant-base-box-from-an-existing-one,Scotch
Build A Real-Time Twitter Stream with Node and React.js,Ken Wheeler,"expressJS,node.js,react",https://scotch.io/tutorials/build-a-real-time-twitter-stream-with-node-and-react-js,Scotch
Learning React.js: Getting Started and Concepts,Ken Wheeler,"node.js,react",https://scotch.io/tutorials/learning-react-getting-started-and-concepts,Scotch
Getting Started with SASS (with interactive examples),Ken Wheeler,"css,sass,SCSS",https://scotch.io/tutorials/getting-started-with-sass,Scotch
AngularJS Best Practices: Directory Structure,Ado Kukic,angularJS,https://scotch.io/tutorials/angularjs-best-practices-directory-structure,Scotch
Use AngularJS and ngHref to Grab CSS Dynamically,Chris Sevilleja,angularJS,https://scotch.io/tutorials/use-angularjs-and-nghref-to-grab-css-dynamically,Scotch
Building Your Own JavaScript Modal Plugin,Ken Wheeler,"javascript,plugins",https://scotch.io/tutorials/building-your-own-javascript-modal-plugin,Scotch
Reorder CSS Columns Using Bootstrap,Chris Sevilleja,"bootstrap,css",https://scotch.io/tutorials/reorder-css-columns-using-bootstrap,Scotch
Node and npm Version Numbering: Guide and Best Practices,Chris Sevilleja,node.js,https://scotch.io/tutorials/node-and-npm-version-numbering-guide-and-best-practices,Scotch
How to use “git remove” without deleting the files,Nicholas Cerminara,git,https://scotch.io/tutorials/how-to-use-git-remove-without-deleting-the-files,Scotch
How to create an SSH shortcut,Nicholas Cerminara,"command line,keyboard shortcuts",https://scotch.io/tutorials/how-to-create-an-ssh-shortcut,Scotch
How to Change a CSS Background Image’s Opacity,Nicholas Cerminara,css,https://scotch.io/tutorials/how-to-change-a-css-background-images-opacity,Scotch
Understanding ZURB Foundation 5’s Grid System,Chris Sevilleja,foundation,https://scotch.io/tutorials/understanding-zurb-foundation-5s-grid-system,Scotch
Cheat Sheet for Comparing Bootstrap and Foundation CSS Classes,Chris Sevilleja,"cheat sheet,foundation",https://scotch.io/tutorials/cheat-sheet-for-comparing-bootstrap-and-foundation-css-classes,Scotch
Foundation 5 Features that Bootstrap Doesn’t Have,Chris Sevilleja,foundation,https://scotch.io/tutorials/foundation-5-features-that-bootstrap-doesnt-have,Scotch
Getting Started with Foundation 5 by ZURB,Chris Sevilleja,foundation,https://scotch.io/tutorials/getting-started-with-foundation-5-by-zurb,Scotch
Open Sublime Text From the Command Line Using subl.exe (Windows),Chris Sevilleja,sublime text,https://scotch.io/tutorials/open-sublime-text-from-the-command-line-using-subl-exe-windows,Scotch
Using Git Inside of Sublime Text to Improve Workflow,Chris Sevilleja,"git,sublime text",https://scotch.io/tutorials/using-git-inside-of-sublime-text-to-improve-workflow,Scotch
The Many Ways To Use ngClass,Chris Sevilleja,angularJS,https://scotch.io/tutorials/the-many-ways-to-use-ngclass,Scotch
Use EJS to Template Your Node Application,Chris Sevilleja,node.js,https://scotch.io/tutorials/use-ejs-to-template-your-node-application,Scotch
Animating Angular Apps: ngShow and ngHide,Chris Sevilleja,"angularJS,css",https://scotch.io/tutorials/animating-angular-apps-ngshow-and-nghide,Scotch
Getting Started with Laravel Homestead,Nicholas Cerminara,"homestead,laravel,php,vagrant",https://scotch.io/tutorials/getting-started-with-laravel-homestead,Scotch
Google Material Design Input Boxes in CSS3,Chris Sevilleja,"css,material design",https://scotch.io/tutorials/google-material-design-input-boxes-in-css3,Scotch
3 Simple Tips for Using UI-Router,Chris Sevilleja,"angularJS,ui-router",https://scotch.io/tutorials/3-simple-tips-for-using-ui-router,Scotch
Declaring AngularJS Modules For Minification,Chris Sevilleja,angularJS,https://scotch.io/tutorials/declaring-angularjs-modules-for-minification,Scotch
Using GruntJS in a MEAN Stack Application,Chris Sevilleja,"angularJS,grunt,MEAN,node.js",https://scotch.io/tutorials/using-gruntjs-in-a-mean-stack-application,Scotch
Laravel Form Validation,Chris Sevilleja,"forms,laravel,validation",https://scotch.io/tutorials/laravel-form-validation,Scotch
Escaping Data in Laravel Blade Files,Chris Sevilleja,laravel,https://scotch.io/tutorials/escaping-data-in-laravel-blade-files,Scotch
Sharing Your Virtual Machine on the Web with Vagrant Share,Nicholas Cerminara,"starter,vagrant",https://scotch.io/tutorials/sharing-your-virtual-machine-on-the-web-with-vagrant-share,Scotch
Create a Google Polymer Checkbox Using CSS3,Chris Sevilleja,"css,ui/ux",https://scotch.io/tutorials/create-a-google-polymer-checkbox-using-css3,Scotch
Building Dynamic Angular Forms with ngRepeat and ngForm,Chris Sevilleja,"angularJS,forms,validation",https://scotch.io/tutorials/building-dynamic-angular-forms-with-ngrepeat-and-ngform,Scotch
Upgrading Our “Easy Node Authentication” Series to ExpressJS 4.0,Chris Sevilleja,"expressJS,node.js",https://scotch.io/tutorials/upgrading-our-easy-node-authentication-series-to-expressjs-4-0,Scotch
All Favicons for All Devices and Sizes,Nicholas Cerminara,"seo,social,starter",https://scotch.io/tutorials/all-favicons-for-all-devices-and-sizes,Scotch
AngularJS Multi-Step Form Using UI Router,Chris Sevilleja,"angularJS,forms,ui-router",https://scotch.io/tutorials/angularjs-multi-step-form-using-ui-router,Scotch
All Search and Social Media Meta Tags Starter Template,Nicholas Cerminara,"seo,social,starter",https://scotch.io/tutorials/all-search-and-social-media-meta-tags-starter-template,Scotch
Off Canvas Menus with CSS3 Transitions and Transforms,Nicholas Cerminara,"css,ui/ux",https://scotch.io/tutorials/off-canvas-menus-with-css3-transitions-and-transforms,Scotch
Build a RESTful API Using Node and Express 4,Chris Sevilleja,"API,expressJS,MEAN,mongoDB,node.js,REST",https://scotch.io/tutorials/build-a-restful-api-using-node-and-express-4,Scotch
Learn to Use the New Router in ExpressJS 4.0,Chris Sevilleja,"expressJS,node.js,routing",https://scotch.io/tutorials/learn-to-use-the-new-router-in-expressjs-4,Scotch
A Simple Guide to Getting Started With Grunt,Chris Sevilleja,"dev environment,grunt,node.js",https://scotch.io/tutorials/a-simple-guide-to-getting-started-with-grunt,Scotch
Connecting to a MongoDB Database Using Robomongo,Chris Sevilleja,mongoDB,https://scotch.io/tutorials/connecting-to-mongodb-using-robomongo,Scotch
How to Setup GitLab: A Self Hosted GitHub,Nicholas Cerminara,git,https://scotch.io/tutorials/how-to-setup-gitlab-a-self-hosted-github,Scotch
Scraping the Web With Node.js,Ado Kukic,node.js,https://scotch.io/tutorials/scraping-the-web-with-node-js,Scotch
Get Beautiful Syntax Highlighting For Your Website Code,Chris Sevilleja,editors,https://scotch.io/tutorials/get-beautiful-syntax-highlighting-for-your-website-code,Scotch
Route Middleware to Check if a User is Authenticated in Node.js,Chris Sevilleja,"node.js,routing",https://scotch.io/tutorials/route-middleware-to-check-if-a-user-is-authenticated-in-node-js,Scotch
AngularJS Routing Using UI-Router,Chris Sevilleja,"angularJS,routing,SPA,ui-router",https://scotch.io/tutorials/angular-routing-using-ui-router,Scotch
How To Use ngShow and ngHide,Chris Sevilleja,angularJS,https://scotch.io/tutorials/how-to-use-ngshow-and-nghide,Scotch
How to push an existing project to GitHub,Nicholas Cerminara,git,https://scotch.io/tutorials/how-to-push-an-existing-project-to-github,Scotch
Default Sizes for Twitter Bootstrap’s Media Queries,Nicholas Cerminara,"bootstrap,css,starter",https://scotch.io/tutorials/default-sizes-for-twitter-bootstraps-media-queries,Scotch
A Guide to Using Eloquent ORM in Laravel,Chris Sevilleja,"crud,eloquent,laravel",https://scotch.io/tutorials/a-guide-to-using-eloquent-orm-in-laravel,Scotch
Handling Checkboxes and Radio Buttons in Angular Forms,Chris Sevilleja,"angularJS,forms",https://scotch.io/tutorials/handling-checkboxes-and-radio-buttons-in-angular-forms,Scotch
Animating AngularJS Apps: ngView,Chris Sevilleja,angularJS,https://scotch.io/tutorials/animating-angularjs-apps-ngview,Scotch
How to Setup SSH Public-Key Authentication,Nicholas Cerminara,command line,https://scotch.io/tutorials/how-to-setup-ssh-public-key-authentication,Scotch
Converting Photoshop Letter Spacing to CSS,Nicholas Cerminara,css,https://scotch.io/tutorials/converting-photoshop-letter-spacing-to-css,Scotch
How to Encode and Decode Strings with Base64 in JavaScript,Nicholas Cerminara,"base64,javascript,jquery",https://scotch.io/tutorials/how-to-encode-and-decode-strings-with-base64-in-javascript,Scotch
"Easily Create, Read, and Erase Cookies with jQuery",Nicholas Cerminara,"cookies,javascript,jquery",https://scotch.io/tutorials/easily-create-read-and-erase-cookies-with-jquery,Scotch
Making HTML5 Placeholder Input Fields Cross-Browser with jQuery,Nicholas Cerminara,forms,https://scotch.io/tutorials/making-html5-placeholder-input-fields-cross-browser-with-jquery,Scotch
Rotating Social Icons on Page Scroll,Chris Sevilleja,"css,javascript",https://scotch.io/tutorials/rotating-social-icons-on-page-scroll,Scotch
CSS3 Hidden Social Buttons,Chris Sevilleja,"css,social",https://scotch.io/tutorials/css3-hidden-social-buttons,Scotch
Understanding Laravel Route Parameters,Chris Sevilleja,"laravel,routing",https://scotch.io/tutorials/understanding-laravel-route-parameters,Scotch
Create a Laravel and Angular Single Page Comment Application,Chris Sevilleja,"laravel,SPA",https://scotch.io/tutorials/create-a-laravel-and-angular-single-page-comment-application,Scotch
Pretty URLs in AngularJS: Removing the #,Chris Sevilleja,angularJS,https://scotch.io/tutorials/pretty-urls-in-angularjs-removing-the-hashtag,Scotch
AngularJS SEO with Prerender.io,Ado Kukic,"angularJS,seo",https://scotch.io/tutorials/angularjs-seo-with-prerender-io,Scotch
Setting Up a MEAN Stack Single Page Application,Chris Sevilleja,"angularJS,MEAN,node.js,SPA",https://scotch.io/tutorials/setting-up-a-mean-stack-single-page-application,Scotch
Manage Front End Resources with Bower,Chris Sevilleja,bower,https://scotch.io/tutorials/manage-front-end-resources-with-bower,Scotch
How to Remap Escape in Sublime Text 3’s Vintage Mode,Chris Sevilleja,"editors,sublime text",https://scotch.io/tutorials/how-to-remap-escape-in-sublime-text-3s-vintage-mode,Scotch
Submitting AJAX Forms with jQuery,Chris Sevilleja,"ajax,forms,javascript,jquery",https://scotch.io/tutorials/submitting-ajax-forms-with-jquery,Scotch
How to Export a Photoshop Pattern to an Image,Nicholas Cerminara,,https://scotch.io/tutorials/how-to-export-a-photoshop-pattern-to-an-image,Scotch
AngularJS Form Validation,Chris Sevilleja,"angularJS,forms,validation",https://scotch.io/tutorials/angularjs-form-validation,Scotch
Laravel Form Model Binding,Chris Sevilleja,"forms,laravel,php",https://scotch.io/tutorials/laravel-form-model-binding,Scotch
Understanding the Bootstrap 3 Grid System,Chris Sevilleja,"bootstrap,css",https://scotch.io/tutorials/understanding-the-bootstrap-3-grid-system,Scotch
Easy Node Authentication: Linking All Accounts Together,Chris Sevilleja,"authentication,node.js",https://scotch.io/tutorials/easy-node-authentication-linking-all-accounts-together,Scotch
Get VAGRANT UP and Running in No Time,Nicholas Cerminara,"starter,vagrant",https://scotch.io/tutorials/get-vagrant-up-and-running-in-no-time,Scotch
Removing WordPress Header Junk,Chris Sevilleja,wordpress,https://scotch.io/tutorials/removing-wordpress-header-junk,Scotch
Write HTML Crazy Fast with Emmet: An Interactive Guide,Chris Sevilleja,"editors,emmet",https://scotch.io/tutorials/write-html-crazy-fast-with-emmet-an-interactive-guide,Scotch
