title,author,tags,link,source
Easy Node Authentication: Google,Chris Sevilleja,"authentication,node.js",https://scotch.io/tutorials/easy-node-authentication-google,Scotch
Easy Node Authentication: Twitter,Chris Sevilleja,"authentication,node.js",https://scotch.io/tutorials/easy-node-authentication-twitter,Scotch
Node and Angular To-Do App: Controllers and Services,Chris Sevilleja,"angularJS,MEAN,node.js",https://scotch.io/tutorials/node-and-angular-to-do-app-controllers-and-services,Scotch
Easy Node Authentication: Facebook,Chris Sevilleja,"authentication,node.js",https://scotch.io/tutorials/easy-node-authentication-facebook,Scotch
Easy Node Authentication: Setup and Local,Chris Sevilleja,"authentication,node.js",https://scotch.io/tutorials/easy-node-authentication-setup-and-local,Scotch
Submitting AJAX Forms: The AngularJS Way,Chris Sevilleja,"angularJS,forms",https://scotch.io/tutorials/submitting-ajax-forms-the-angularjs-way,Scotch
Node and Angular To-Do App: Application Organization and Structure,Chris Sevilleja,"angularJS,MEAN,node.js",https://scotch.io/tutorials/node-and-angular-to-do-app-application-organization-and-structure,Scotch
Creating a Single Page Todo App with Node and Angular,Chris Sevilleja,"angularJS,MEAN,node.js",https://scotch.io/tutorials/creating-a-single-page-todo-app-with-node-and-angular,Scotch
Using Laravel Blade with AngularJS,Chris Sevilleja,"angularJS,laravel",https://scotch.io/tutorials/quick-tip-using-laravel-blade-with-angularjs,Scotch
Single Page Apps with AngularJS Routing and Templating,Chris Sevilleja,"angularJS,routing",https://scotch.io/tutorials/single-page-apps-with-angularjs-routing-and-templating,Scotch
Get a Functional and Sleek Console in Windows,Chris Sevilleja,"dev environment,editors",https://scotch.io/tutorials/get-a-functional-and-sleek-console-in-windows,Scotch
How to Share Webpages with Facebook,Nicholas Cerminara,,https://scotch.io/tutorials/how-to-share-webpages-with-facebook,Scotch
How to Share Webpages with Twitter,Nicholas Cerminara,,https://scotch.io/tutorials/how-to-share-webpages-with-twitter,Scotch
Simple Laravel Layouts using Blade,Chris Sevilleja,laravel,https://scotch.io/tutorials/simple-laravel-layouts-using-blade,Scotch
CSS3 Page Landing Animations,Chris Sevilleja,css,https://scotch.io/tutorials/css3-page-landing-animations,Scotch
Simple Laravel CRUD with Resource Controllers,Chris Sevilleja,laravel,https://scotch.io/tutorials/simple-laravel-crud-with-resource-controllers,Scotch
Simple and Easy Laravel Routing,Chris Sevilleja,laravel,https://scotch.io/tutorials/simple-and-easy-laravel-routing,Scotch
Simple and Easy Laravel Login Authentication,Chris Sevilleja,"authentication,laravel",https://scotch.io/tutorials/simple-and-easy-laravel-login-authentication,Scotch
Cygwin Starter Configuration and Instructions,Chris Sevilleja,,https://scotch.io/tutorials/cygwin-starter-configuration-and-instructions,Scotch
