title,author,tags,link,source
"Create a Single Page App With Go, Echo and Vue",Ed Zynda,"go,javascript,SPA,vue.js",https://scotch.io/tutorials/create-a-single-page-app-with-go-echo-and-vue,Scotch
Angular 2 Form Validation,Ado Kukic,"angular2,authentication,forms,validation",https://scotch.io/tutorials/angular-2-form-validation,Scotch
Build search functionality with Laravel Scout and Vue.js,Rachid Laasri,"laravel,vue.js",https://scotch.io/tutorials/build-search-functionality-with-laravel-scout-and-vue-js,Scotch
Getting Started with Webpack: Module Bundling Magic,Samuel Oloruntoba,"javascript,webpack",https://scotch.io/tutorials/getting-started-with-webpack-module-bundling-magic,Scotch
Serverless Computing: A Rad Word Chat Filter,Josh Marinacci,javascript,https://scotch.io/tutorials/serverless-computing-a-rad-word-chat-filter,Scotch
Meet AdonisJs! A Laravel-style MVC Framework for Node.js,,"javascript,node.js",https://scotch.io/tutorials/meet-adonisjs-a-laravel-style-mvc-framework-for-node-js,Scotch
Create a Simple To-Do App With React,Chris Nwamba,"javascript,react",https://scotch.io/tutorials/create-a-simple-to-do-app-with-react,Scotch
Build a Customer Service Messaging App in 5 minutes,Prosper Otemuyiwa,,https://scotch.io/tutorials/build-a-customer-service-messaging-app-in-5-minutes,Scotch
Routing React Apps: The Complete Guide,Chris Nwamba,"javascript,react",https://scotch.io/tutorials/routing-react-apps-the-complete-guide,Scotch
Getting Started with CSS Counters,Samuel Oloruntoba,css,https://scotch.io/tutorials/getting-started-with-css-counters,Scotch
Build a React App with User Authentication,Robin Orheden,"authentication,javascript,node.js",https://scotch.io/tutorials/build-a-react-app-with-user-authentication,Scotch
React on the Server for Beginners: Build a Universal React and Node App,Luciano Mammino,"expressJS,javascript,node.js,react,routing",https://scotch.io/tutorials/react-on-the-server-for-beginners-build-a-universal-react-and-node-app,Scotch
Document your Already Existing APIs with Swagger,Ganga Chris,"API,github",https://scotch.io/tutorials/document-your-already-existing-apis-with-swagger,Scotch
Easy and Fast Emails with Laravel 5.3 Mailables,Samuel Oloruntoba,"laravel,php",https://scotch.io/tutorials/easy-and-fast-emails-with-laravel-5-3-mailables,Scotch
ReactJS Components: Learning the Basics,Chris Nwamba,"javascript,react",https://scotch.io/tutorials/reactjs-components-learning-the-basics,Scotch
Testing AngularJS with Jasmine and Karma (Part 2),Adam Morgan,"angularJS,jasmine,javascript,karma",https://scotch.io/tutorials/testing-angularjs-with-jasmine-and-karma-part-2,Scotch
Build a Laravel Application with User Authentication,Brian Retterer,"authentication,laravel",https://scotch.io/tutorials/build-a-laravel-application-with-user-authentication,Scotch
DNS Explained – How Your Browser Finds Websites,Jeff Smith,,https://scotch.io/tutorials/dns-explained-how-your-browser-finds-websites,Scotch
Building and Securing a Modern Backend API,Ado Kukic,"API,authentication,node.js",https://scotch.io/tutorials/building-and-securing-a-modern-backend-api,Scotch
How to Implement a Custom Validator Directive (Confirm Password) in Angular 2,Jecelyn Yeen,"angular2,angularJS,javascript,typescript",https://scotch.io/tutorials/how-to-implement-a-custom-validator-directive-confirm-password-in-angular-2,Scotch
Using HammerJS (Touch gesture) in Angular 2,Jecelyn Yeen,"angular2,angularJS,javascript,typescript",https://scotch.io/tutorials/using-hammerjs-touch-gesture-in-angular-2,Scotch
Build A Support Ticket Application With Laravel – Part 2,Chimezie Enyinnaya,"laravel,php",https://scotch.io/tutorials/build-a-support-ticket-application-with-laravel-part-2,Scotch
Creating An AngularJS Application With Sequelize – Part 1,John Kariuki,"javascript,node.js",https://scotch.io/tutorials/creating-an-angularjs-application-with-sequelize-part-1,Scotch
Understanding Ruby Closures,Noman Ur Rehman,ruby,https://scotch.io/tutorials/understanding-ruby-closures,Scotch
Build a Spring Boot App with User Authentication,Micah Silverman,"authentication,java,OAuth",https://scotch.io/tutorials/build-a-spring-boot-app-with-user-authentication,Scotch
Build a Blog with Ruby on Rails – Part 1,,"crud,ruby",https://scotch.io/tutorials/build-a-blog-with-ruby-on-rails-part-1,Scotch
Interactive Angular 2 Charts with ZingChart,,"angular2,angularJS",https://scotch.io/tutorials/interactive-angular-2-charts-with-zingchart,Scotch
Simple Language Translation in Angular 2 (Part 2),Jecelyn Yeen,"angular2,angularJS,javascript,typescript",https://scotch.io/tutorials/simple-language-translation-in-angular-2-part-2,Scotch
Simple Language Translation in Angular 2 (Part 1),Jecelyn Yeen,"angular2,angularJS,javascript,typescript",https://scotch.io/tutorials/simple-language-translation-in-angular-2-part-1,Scotch
Debugging Angular 2 Apps with Augury,Ganga Chris,"angular2,angularJS,javascript",https://scotch.io/tutorials/debugging-angular-2-apps-with-augury,Scotch
Angular 2 HTTP Requests with Observables,Chris Nwamba,"angular2,angularJS,javascript",https://scotch.io/tutorials/angular-2-http-requests-with-observables,Scotch
How to Implement Conditional Validation in Angular 2 Model-driven Forms,Jecelyn Yeen,"angular2,angularJS,javascript,typescript",https://scotch.io/tutorials/how-to-implement-conditional-validation-in-angular-2-model-driven-forms,Scotch
A Crash Course in Ruby,Noman Ur Rehman,ruby,https://scotch.io/tutorials/a-crash-course-in-ruby,Scotch
Continuous Integration – Debugging Live CircleCI Builds with SSH Access,John Kariuki,dev environment,https://scotch.io/tutorials/continuous-integration-debugging-live-circleci-builds-with-ssh-access,Scotch
Build A Support Ticket Application With Laravel – Part 1,Chimezie Enyinnaya,"laravel,php",https://scotch.io/tutorials/build-a-support-ticket-application-with-laravel-part-1,Scotch
How to Use Laravel Config Files,Samuel Oloruntoba,"laravel,php",https://scotch.io/tutorials/how-to-use-laravel-config-files,Scotch
How to Build Nested Model-driven Forms in Angular 2,Jecelyn Yeen,"angular2,angularJS,forms,javascript,typescript",https://scotch.io/tutorials/how-to-build-nested-model-driven-forms-in-angular-2,Scotch
Understanding Angular 1.5 Lifecycle Hooks,Nyambati Thomas,"angularJS,javascript",https://scotch.io/tutorials/understanding-angular-1-5-lifecycle-hooks,Scotch
A Deep Dive into Laravel 5.3 Features,John Kariuki,"laravel,php",https://scotch.io/tutorials/a-deep-dive-into-laravel-5-3-features,Scotch
NativeBase: The Missing Piece of React Native​,Chris Sevilleja,react,https://scotch.io/tutorials/nativebase-the-missing-piece-of-react-native%e2%80%8b,Scotch
Routing Angular 2 Single Page Apps with the Component Router,Chris Nwamba,"Angular Material,angular2,angularJS,javascript",https://scotch.io/tutorials/routing-angular-2-single-page-apps-with-the-component-router,Scotch
Using Angular 2’s Model-Driven Forms with FormGroup and FormControl,Jecelyn Yeen,"angular2,angularJS,javascript,typescript",https://scotch.io/tutorials/using-angular-2s-model-driven-forms-with-formgroup-and-formcontrol,Scotch
Using Angular 2’s Template-Driven Forms,Jecelyn Yeen,"angular2,angularJS,javascript,typescript",https://scotch.io/tutorials/using-angular-2s-template-driven-forms,Scotch
How to Deal with Different Form Controls in Angular 2,Jecelyn Yeen,"angular2,angularJS,javascript,typescript",https://scotch.io/tutorials/how-to-deal-with-different-form-controls-in-angular-2,Scotch
Build a Chrome Extension for Real-time Price Tracking with Appbase,,"appbase,javascript",https://scotch.io/tutorials/build-a-chrome-extension-for-real-time-price-tracking-with-appbase,Scotch
Build a Chrome Extension for Real-time Price Tracking with Appbase,,"appbase,javascript",https://scotch.io/tutorials/build-a-chrome-extension-for-real-time-price-tracking-with-appbase,Scotch
Server-side Web Components: How and Why?,Jordan Last,"electron,javascript,node.js,polymer",https://scotch.io/tutorials/server-side-web-components-how-and-why,Scotch
Test a Node RESTful API with Mocha and Chai,Samuele Zaza,"API,node.js,testing",https://scotch.io/tutorials/test-a-node-restful-api-with-mocha-and-chai,Scotch
Build Your First Python and Django Application,Amos Omondi,"django,python",https://scotch.io/tutorials/build-your-first-python-and-django-application,Scotch
How to Use Angular 1.5’s Component Method,Nyambati Thomas,"angularJS,javascript,SPA",https://scotch.io/tutorials/how-to-use-angular-1-5s-component-method,Scotch
Implementing Smart Search with Laravel and Typeahead.js,Hammad Ahmed,"javascript,laravel,php",https://scotch.io/tutorials/implementing-smart-search-with-laravel-and-typeahead-js,Scotch
Speed up your RESTful API development in Node.js with Swagger,Samuele Zaza,"API,javascript,node.js,REST",https://scotch.io/tutorials/speed-up-your-restful-api-development-in-node-js-with-swagger,Scotch
Build a Mobile App with Angular 2 and Ionic 2,Ganga Chris,"angular2,ionic,javascript",https://scotch.io/tutorials/build-a-mobile-app-with-angular-2-and-ionic-2,Scotch
Get Laravel Route Parameters in Middleware,Ganga Chris,laravel,https://scotch.io/tutorials/get-laravel-route-parameters-in-middleware,Scotch
Deliver the Perfect Image to Every User with Cloudinary,Holly Lloyd,javascript,https://scotch.io/tutorials/deliver-the-perfect-image-to-every-user-with-cloudinary,Scotch
Laravel 5.3 New Features and Updates,Samuel Oloruntoba,"laravel,php",https://scotch.io/tutorials/laravel-5-3-new-features-and-updates,Scotch
Build a PhantomJS Website Screenshot App (Part 2): The Server,Samuel Oloruntoba,"javascript,phantomJS",https://scotch.io/tutorials/build-a-phantomjs-website-screenshot-app-part-2-the-server,Scotch
Laravel Collections: PHP Arrays On Steroids,John Kariuki,"eloquent,laravel,php",https://scotch.io/tutorials/laravel-collections-php-arrays-on-steroids,Scotch
Creating A Laravel 404 Page Using Custom Exception Handlers,John Kariuki,"laravel,php",https://scotch.io/tutorials/creating-a-laravel-404-page-using-custom-exception-handlers,Scotch
Properly Set Environment Variables for Angular Apps with gulp-ng-config,Hannah Koske,"angularJS,gulp,javascript",https://scotch.io/tutorials/properly-set-environment-variables-for-angular-apps-with-gulp-ng-config,Scotch
Build a Screenshot App (Part 1): Web Page Module and Screen Capture,Samuel Oloruntoba,"javascript,phantomJS",https://scotch.io/tutorials/build-a-screenshot-app-part-1-web-page-module-and-screen-capture,Scotch
Getting Started with Hapi.js,,"hapi,javascript,node.js",https://scotch.io/tutorials/getting-started-with-hapi-js,Scotch
Build a Twitter Like Search Feed with React.js and appbase.io,Siddharth Kothari,"appbase,javascript,react,real time",https://scotch.io/tutorials/build-a-twitter-like-search-feed-with-react-js-and-appbase-io,Scotch
"Understanding JavaScript Promises, Pt. I: Background & Basics",Peleke Sengstacke,"es6,javascript,node.js",https://scotch.io/tutorials/understanding-javascript-promises-pt-i-background-basics,Scotch
Build a Real Battery Status Web Component with Polymer,Nemanja Popovic,"javascript,polymer",https://scotch.io/tutorials/build-a-real-battery-status-web-component-with-polymer,Scotch
Testing AngularJS with Jasmine and Karma (Part 1),Adam Morgan,"angularJS,jasmine,javascript,karma",https://scotch.io/tutorials/testing-angularjs-with-jasmine-and-karma-part-1,Scotch
Build a Mini Instagram App with Aurelia,Chris Nwamba,"aurelia,javascript",https://scotch.io/tutorials/build-a-mini-instagram-app-with-aurelia,Scotch
Build Interactive Diagrams with GoJS,Simon Sarris,"gojs,javascript",https://scotch.io/tutorials/build-interactive-diagrams-with-gojs,Scotch
Debugging JavaScript with Chrome DevTools Breakpoints,Ganga Chris,"chrome,javascript",https://scotch.io/tutorials/debugging-javascript-with-chrome-devtools-breakpoints,Scotch
"Building a Google Keep Clone with Vue and Firebase, Pt 3",Niels Swimberghe,"authentication,firebase,javascript,node.js,vue.js",https://scotch.io/tutorials/building-a-google-keep-clone-with-vue-and-firebase-pt-3,Scotch
Full E-Commerce Integration of Snipcart with WordPress,Yanick Ouellet,"API,javascript,php,REST,wordpress",https://scotch.io/tutorials/full-e-commerce-integration-of-snipcart-with-wordpress,Scotch
Understanding Laravel Middleware,Samuel Oloruntoba,"laravel,php",https://scotch.io/tutorials/understanding-laravel-middleware,Scotch
How to Send a Pull Request using the Github Desktop Client,Noman Ur Rehman,"git,github",https://scotch.io/tutorials/how-to-send-a-pull-request-using-the-github-desktop-client,Scotch
Why You Shouldn’t Be Scared of TypeScript,Peleke Sengstacke,"es6,javascript,typescript",https://scotch.io/tutorials/why-you-shouldnt-be-scared-of-typescript,Scotch
What is PhantomJS and How is it Used?,Samuel Oloruntoba,"javascript,phantomJS",https://scotch.io/tutorials/what-is-phantomjs-and-how-is-it-used,Scotch
Quick Tip: Make Composer Auto-Update Itself,Samuel Oloruntoba,"composer,php",https://scotch.io/tutorials/quick-tip-make-composer-auto-update-itself,Scotch
Use Laravel Valet for a Super Quick Dev Server,Noman Ur Rehman,"laravel,php",https://scotch.io/tutorials/use-laravel-valet-for-a-super-quick-dev-server,Scotch
Sharing Data Between Views Using Laravel View Composers,John Kariuki,"laravel,php",https://scotch.io/tutorials/sharing-data-between-views-using-laravel-view-composers,Scotch
Contributing to Open Source Software with Git,Noman Ur Rehman,"git,github",https://scotch.io/tutorials/contributing-to-open-source-software-with-git,Scotch
"From JavaScript to TypeScript, Pt. IV: Generics & Algebraic Data Types",Peleke Sengstacke,"javascript,typescript",https://scotch.io/tutorials/from-javascript-to-typescript-pt-iv-generics-algebraic-data-types,Scotch
How to Sprinkle ReactJS into an Existing Web Application,Andrew Del Prete,"javascript,react",https://scotch.io/tutorials/how-to-sprinkle-reactjs-into-an-existing-web-application,Scotch
Build a React + Flux App with User Authentication,Ryan Chenkie,"authentication,javascript,react",https://scotch.io/tutorials/build-a-react-flux-app-with-user-authentication,Scotch
"Building a Google Keep Clone with Vue and Firebase, Pt 2",Niels Swimberghe,"firebase,javascript,node.js,real time,vue.js",https://scotch.io/tutorials/building-a-google-keep-clone-with-vue-and-firebase-pt-2,Scotch
"From JavaScript to TypeScript, Pt. III: Type Inference & Compatibility",Peleke Sengstacke,"javascript,typescript",https://scotch.io/tutorials/from-javascript-to-typescript-pt-iii-type-inference-compatibility,Scotch
Use the Angular CLI For Faster Angular 2 Projects,Chris Sevilleja,"angular2,angularJS,javascript",https://scotch.io/tutorials/use-the-angular-cli-for-faster-angular-2-projects,Scotch
"Building a Google Keep Clone with Vue and Firebase, Pt 1",Niels Swimberghe,"firebase,javascript,node.js,real time,vue.js",https://scotch.io/tutorials/building-a-google-keep-clone-with-vue-and-firebase-pt-1,Scotch
Get to Know the Page Visibility API,Samuel Oloruntoba,html5,https://scotch.io/tutorials/get-to-know-the-page-visibility-api,Scotch
"From JavaScript to TypeScript, Pt. IIB: Designing with Classes, Interfaces, & Mixins",Peleke Sengstacke,"javascript,typescript",https://scotch.io/tutorials/from-javascript-to-typescript-pt-iib-designing-with-classes-interfaces-mixins,Scotch
"From JavaScript to TypeScript, Pt. IIA: Using Classes, Interfaces, & Mixins",Peleke Sengstacke,"es6,javascript,typescript",https://scotch.io/tutorials/from-javascript-to-typescript-pt-iia-using-classes-interfaces-mixins,Scotch
Tinker with the Data in Your Laravel Apps with Php Artisan Tinker,Samuel Oloruntoba,"laravel,php",https://scotch.io/tutorials/tinker-with-the-data-in-your-laravel-apps-with-php-artisan-tinker,Scotch
From JavaScript to TypeScript Pt. I: Types & Variables,Peleke Sengstacke,"es6,javascript,typescript",https://scotch.io/tutorials/from-javascript-to-typescript-pt-i-types-variables,Scotch
Build a Music Player with React & Electron III: Bringing It All Together,Chris Nwamba,"electron,javascript,react",https://scotch.io/tutorials/build-a-music-player-with-react-electron-iii-bringing-it-all-together,Scotch
Prototype Quickly in Laravel with PHP’s Built-In Server and SQLite,Noman Ur Rehman,"laravel,php",https://scotch.io/tutorials/prototype-quickly-in-laravel-with-phps-built-in-server-and-sqlite,Scotch
Build a Music Player with React & Electron II: Making the UI,Chris Nwamba,"electron,javascript,react",https://scotch.io/tutorials/build-a-music-player-with-react-electron-ii-making-the-ui,Scotch
How To Process Tweets in Real-Time with Laravel,Daniel Abernathy,"API,homestead,laravel,php",https://scotch.io/tutorials/how-to-process-tweets-in-real-time-with-laravel,Scotch
How to Log Client-Side JavaScript Errors,Thomas Peham,javascript,https://scotch.io/tutorials/how-to-log-client-side-javascript-errors,Scotch
Build a Music Player with React & Electron I: Setup & Basic Concepts,Chris Nwamba,"electron,javascript,react",https://scotch.io/tutorials/build-a-music-player-with-react-electron-i-setup-basic-concepts,Scotch
JavaScript Transpilers: What They Are & Why We Need Them,Peleke Sengstacke,"javascript,node.js",https://scotch.io/tutorials/javascript-transpilers-what-they-are-why-we-need-them,Scotch
"Build a Single Page Time Tracking App with Vue.js, Part II",Ryan Chenkie,"javascript,SPA,vue.js",https://scotch.io/tutorials/build-a-single-page-time-tracking-app-with-vue-js-part-ii,Scotch
"Better JavaScript with ES6, Pt. III: Cool Collections & Slicker Strings",Peleke Sengstacke,"javascript,node.js",https://scotch.io/tutorials/better-javascript-with-es6-pt-iii-cool-collections-slicker-strings,Scotch
How to Use Environment Variables,Samuel Oloruntoba,,https://scotch.io/tutorials/how-to-use-environment-variables,Scotch
Build a Single Page Time Tracking App with Vue.js: Introduction,Evan You,"javascript,SPA,vue.js",https://scotch.io/tutorials/build-a-single-page-time-tracking-app-with-vue-js-introduction,Scotch
"Better JavaScript with ES6, Pt. II: A Deep Dive into Classes",Peleke Sengstacke,"javascript,node.js",https://scotch.io/tutorials/better-javascript-with-es6-pt-ii-a-deep-dive-into-classes,Scotch
Generate Dummy Laravel Data with Model Factories,Samuel Oloruntoba,laravel,https://scotch.io/tutorials/generate-dummy-laravel-data-with-model-factories,Scotch
"Better Node with ES6, Pt. I",Peleke Sengstacke,"es6,javascript,node.js",https://scotch.io/tutorials/better-node-with-es6-pt-i,Scotch
Getting Started with Browserify,Peleke Sengstacke,"javascript,node.js",https://scotch.io/tutorials/getting-started-with-browserify,Scotch
How to Speed Up WordPress with a CDN,Brian Jackson,wordpress,https://scotch.io/tutorials/how-to-speed-up-wordpress-with-a-cdn,Scotch
Cleaner Laravel Controllers with Route Model Binding,Samuel Oloruntoba,laravel,https://scotch.io/tutorials/cleaner-laravel-controllers-with-route-model-binding,Scotch
Creating Your First Angular 2 Components,Thomas Greco,"angular2,javascript",https://scotch.io/tutorials/creating-your-first-angular-2-components,Scotch
Caching in Laravel with Speed Comparisons,Chris Nwamba,laravel,https://scotch.io/tutorials/caching-in-laravel-with-speed-comparisons,Scotch
Keeping API Routing Clean Using Express Routers,Alex Sears,"expressJS,javascript,node.js",https://scotch.io/tutorials/keeping-api-routing-clean-using-express-routers,Scotch
The Ultimate Guide to Sending Email in Laravel,Chris Nwamba,"email,laravel",https://scotch.io/tutorials/ultimate-guide-on-sending-email-in-laravel,Scotch
Build a MEAN Stack File Uploader App with Filestack,Samuele Zaza,"filepicker,javascript,MEAN",https://scotch.io/tutorials/build-a-mean-stack-file-uploader-app-with-filestack,Scotch
Build a Twitter Like Live Search Feed with Appbase.io and JavaScript,Siddharth Kothari,"API,javascript,real time",https://scotch.io/tutorials/build-a-twitter-like-live-search-feed-with-appbase-io-and-javascript,Scotch
All the Ways to Add CSS to Angular 2 Components,Chris Nwamba,"angularJS,javascript",https://scotch.io/tutorials/all-the-ways-to-add-css-to-angular-2-components,Scotch
Role Based Authentication in Laravel with JWT,Chris Nwamba,"jwt,laravel",https://scotch.io/tutorials/role-based-authentication-in-laravel-with-jwt,Scotch
Responsive Carousel Component with Angular 2,Chris Nwamba,"angularJS,javascript",https://scotch.io/tutorials/responsive-carousel-component-with-angular-2,Scotch
How to Use BrowserSync for Faster Development,Samuel Oloruntoba,browsersync,https://scotch.io/tutorials/how-to-use-browsersync-for-faster-development,Scotch
Why Laravel Queues Are Awesome,Chris Nwamba,laravel,https://scotch.io/tutorials/why-laravel-queues-are-awesome,Scotch
Build Your Next Web App 10x Faster with RapidAPI,Iddo Gino,,https://scotch.io/tutorials/build-your-next-web-app-10x-faster-with-rapidapi,Scotch
Build a Custom Photo Widget for Your Desktop with Node.js,Evan Payne,"javascript,node.js",https://scotch.io/tutorials/build-a-custom-photo-widget-for-your-desktop-with-node-js,Scotch
Learning JavaScript Native Functions and How to Use Them,Devan Patel,javascript,https://scotch.io/tutorials/learning-javascript-native-functions-and-how-to-use-them,Scotch
​The Easiest Way to Add Authentication to Any App,Ryan Chenkie,authentication,https://scotch.io/tutorials/%e2%80%8bthe-easiest-way-to-add-authentication-to-any-app,Scotch
Get to Know the Flexbox Grid in Foundation 6,Chris Sevilleja,"css,foundation",https://scotch.io/tutorials/get-to-know-the-flexbox-grid-in-foundation-6,Scotch
Seamless Ways to Upgrade Angular 1.x to Angular 2,Chris Nwamba,"angularJS,javascript",https://scotch.io/tutorials/seamless-ways-to-upgrade-angular-1-x-to-angular-2,Scotch
Easier Date/Time in Laravel and PHP with Carbon,Chris Sevilleja,"laravel,php",https://scotch.io/tutorials/easier-datetime-in-laravel-and-php-with-carbon,Scotch
Create Your First Mobile App with AngularJS and Ionic,Chris Nwamba,"angularJS,ionic",https://scotch.io/tutorials/create-your-first-mobile-app-with-angularjs-and-ionic,Scotch
Learn WebRTC: Build a Real Time Tic-Tac-Toe,Kevin Gleason,webRTC,https://scotch.io/tutorials/learn-webrtc-build-a-real-time-tic-tac-toe,Scotch
Create A Custom Yeoman Generator in 4 Easy Steps,Chris Nwamba,yeoman,https://scotch.io/tutorials/create-a-custom-yeoman-generator-in-4-easy-steps,Scotch
Making MEAN Apps with Google Maps (Part II),Ahmed Haque,"angularJS,MEAN,mongoDB,node.js",https://scotch.io/tutorials/making-mean-apps-with-google-maps-part-ii,Scotch
Create a GitHub File Explorer Using Vue.js,Alex Sears,"github,javascript,vue.js",https://scotch.io/tutorials/create-a-github-file-explorer-using-vue-js,Scotch
Getting Started with Docker,Taylor,docker,https://scotch.io/tutorials/getting-started-with-docker,Scotch
Real User Monitoring with Raygun Pulse,Ado Kukic,,https://scotch.io/tutorials/real-user-monitoring-with-raygun-pulse,Scotch
Create a Real-Time Shoutbox with Laravel Events,Samuel Oloruntoba,"laravel,php",https://scotch.io/tutorials/create-a-real-time-shoutbox-with-laravel-events,Scotch
Create a Custom Audio Player Element using Polymer,Nadi Dikun,polymer,https://scotch.io/tutorials/create-a-custom-audio-player-element-using-polymer,Scotch
Getting Started with Jekyll (plus a Free Bootstrap 3 Starter Theme),Nicholas Cerminara,"bootstrap,jekyll,ruby",https://scotch.io/tutorials/getting-started-with-jekyll-plus-a-free-bootstrap-3-starter-theme,Scotch
Create a MEAN Stack Google Map App (Part I),Ahmed Haque,"angularJS,MEAN,mongoDB,node.js",https://scotch.io/tutorials/making-mean-apps-with-google-maps-part-i,Scotch
Simbla: A Next Generation Responsive Website Builder,Chris Sevilleja,,https://scotch.io/tutorials/simbla-a-next-generation-responsive-website-builder,Scotch
Easy Project Scaffolding with Gulp and Slush,Chris Nwamba,"gulp,javascript,slush",https://scotch.io/tutorials/easy-project-scaffolding-with-gulp-and-slush,Scotch
Containerized Testing for Node Applications with Dockunit,Taylor,"docker,node.js",https://scotch.io/tutorials/containerized-testing-for-node-applications-with-dockunit,Scotch
Build an Etsy Clone with Angular and Stamplay (Part 3),Chris Sevilleja,"angularJS,stamplay",https://scotch.io/tutorials/build-an-etsy-clone-with-angular-and-stamplay-part-3,Scotch
Automatically Format Laravel Database Fields with Accessors and Mutators,Chris Sevilleja,"laravel,php",https://scotch.io/tutorials/automatically-format-laravel-database-fields-with-accessors-and-mutators,Scotch
Aesthetic Sass 3: Typography and Vertical Rhythm,David Khourshid,"css,sass",https://scotch.io/tutorials/aesthetic-sass-3-typography-and-vertical-rhythm,Scotch
Creating Desktop Applications With AngularJS and GitHub Electron,Jasim Muhammed,"angularJS,electron,javascript",https://scotch.io/tutorials/creating-desktop-applications-with-angularjs-and-github-electron,Scotch
Creating a Photo Discovery App with NW.js (part 2),Paul Jensen,"javascript,node.js,NW.js",https://scotch.io/tutorials/creating-a-photo-discovery-app-with-nw-js-part-2,Scotch
Creating a Photo Discovery App with NW.js (part 1),Paul Jensen,"javascript,node.js,NW.js",https://scotch.io/tutorials/creating-a-photo-discovery-app-with-nw-js-part-1,Scotch
Build a To-Do App Using Sails.js and AngularJS,Devan Patel,"angularJS,javascript,node.js,sails.js",https://scotch.io/tutorials/build-a-todo-app-using-sailsjs-and-angularjs,Scotch
Build an Etsy Clone with Angular and Stamplay (Part 2),Chris Sevilleja,"angularJS,javascript,stamplay",https://scotch.io/tutorials/build-an-etsy-clone-with-angular-and-stamplay-part-2,Scotch
Building a Slack Bot with Node.js and Chuck Norris Super Powers,Luciano Mammino,"javascript,node.js,slack",https://scotch.io/tutorials/building-a-slack-bot-with-node-js-and-chuck-norris-super-powers,Scotch
"Make A Real-Time Chat Room using Node Webkit, Socket.io, and MEAN",Chris Nwamba,"MEAN,node.js,socket.io",https://scotch.io/tutorials/a-realtime-room-chat-app-using-node-webkit-socket-io-and-mean,Scotch
